{
  "segment_id": "seg_yt_destiny_2_official_launch_trailer_0049-0050",
  "video_id": "yt_destiny_2_official_launch_trailer",
  "start_sec": 49.215833,
  "end_sec": 50.417033,
  "start_tc": "0:49",
  "end_tc": "0:50",
  "era": "d2_base",
  "activity": "cinematic",
  "content_type": "trailer",
  "caption": "Three Guardians from behind in golden light.",
  "composition": [
    "group"
  ],
  "identity_visibility": "back_only",
  "subject_salience": "ambient",
  "clean": false,
  "footage_tier": "mixed",
  "traversal_hero": false,
  "casting": {
    "role": "none",
    "character": null,
    "person": null,
    "usable": false,
    "constraints_failed": [],
    "slots": 0
  },
  "provenance": {
    "era": {
      "source": "inherited",
      "label_source": "manual",
      "confidence": 0.99
    },
    "activity": {
      "source": "inherited",
      "label_source": "heuristic",
      "confidence": 0.8
    },
    "content_type": {
      "source": "inherited",
      "label_source": "heuristic",
      "confidence": 0.9
    },
    "caption": {
      "source": "observed",
      "label_source": "manual",
      "confidence": 0.8
    },
    "composition": {
      "source": "observed",
      "label_source": "manual",
      "confidence": 0.8
    },
    "identity_visibility": {
      "source": "observed",
      "label_source": "manual",
      "confidence": 0.8
    },
    "subject_salience": {
      "source": "observed",
      "label_source": "manual",
      "confidence": 0.8
    },
    "clean": {
      "source": "observed",
      "label_source": "heuristic",
      "confidence": 1.0
    },
    "footage_tier": {
      "source": "observed",
      "label_source": "heuristic",
      "confidence": 1.0
    },
    "traversal_hero": {
      "source": "observed",
      "label_source": "heuristic",
      "confidence": 1.0
    },
    "casting": {
      "source": "observed",
      "label_source": "heuristic",
      "confidence": 1.0
    }
  }
}
