{
  "segment_id": "seg_yt_official_destiny_launch_gameplay_trailer_0097-0098",
  "video_id": "yt_official_destiny_launch_gameplay_trailer",
  "start_sec": 97.330567,
  "end_sec": 98.364933,
  "start_tc": "1:37",
  "end_tc": "1:38",
  "era": "d1_base",
  "activity": "unknown",
  "content_type": "gameplay",
  "caption": "Two Guardians silhouetted against a glaring tower-sun - verified clean window 97.33-98.36.",
  "overlays": [
    "none"
  ],
  "shot_scale": "LS",
  "lighting": "silhouette",
  "composition": [
    "two_shot"
  ],
  "identity_visibility": "silhouette",
  "character_identifiability": "unidentifiable",
  "subject_salience": "guardian_hero",
  "substitutability": 4,
  "clean": true,
  "footage_tier": "gameplay",
  "traversal_hero": false,
  "casting": {
    "role": "ensemble",
    "character": null,
    "person": null,
    "usable": true,
    "constraints_failed": [],
    "slots": 1
  },
  "provenance": {
    "era": {
      "source": "inherited",
      "label_source": "manual",
      "confidence": 0.99
    },
    "activity": {
      "source": "inherited",
      "label_source": "heuristic",
      "confidence": 0.4
    },
    "content_type": {
      "source": "inherited",
      "label_source": "heuristic",
      "confidence": 0.85
    },
    "caption": {
      "source": "observed",
      "label_source": "manual",
      "confidence": 0.95
    },
    "overlays": {
      "source": "observed",
      "label_source": "manual",
      "confidence": 0.95
    },
    "shot_scale": {
      "source": "observed",
      "label_source": "manual",
      "confidence": 0.95
    },
    "lighting": {
      "source": "observed",
      "label_source": "manual",
      "confidence": 0.95
    },
    "composition": {
      "source": "observed",
      "label_source": "manual",
      "confidence": 0.95
    },
    "identity_visibility": {
      "source": "observed",
      "label_source": "manual",
      "confidence": 0.95
    },
    "character_identifiability": {
      "source": "observed",
      "label_source": "manual",
      "confidence": 0.95
    },
    "subject_salience": {
      "source": "observed",
      "label_source": "manual",
      "confidence": 0.95
    },
    "substitutability": {
      "source": "observed",
      "label_source": "manual",
      "confidence": 0.95
    },
    "clean": {
      "source": "observed",
      "label_source": "heuristic",
      "confidence": 1.0
    },
    "footage_tier": {
      "source": "observed",
      "label_source": "heuristic",
      "confidence": 1.0
    },
    "traversal_hero": {
      "source": "observed",
      "label_source": "heuristic",
      "confidence": 1.0
    },
    "casting": {
      "source": "observed",
      "label_source": "heuristic",
      "confidence": 1.0
    }
  }
}
