{
 "segment_id": "seg_yt_destiny_2_the_final_shape_launch_trailer_0078-0080",
 "video_id": "yt_destiny_2_the_final_shape_launch_trailer",
 "start_sec": 78.144733,
 "end_sec": 80.8808,
 "start_tc": "1:18",
 "end_tc": "1:21",
 "era": "the_final_shape",
 "activity": "cinematic",
 "content_type": "cinematic",
 "destination": "the_pale_heart",
 "subclass_version": "prismatic",
 "class": "unknown",
 "element": "unknown",
 "shot_scale": "MS",
 "composition": [
  "single"
 ],
 "camera_movement": [
  "static"
 ],
 "pacing": "slow",
 "lighting": "dim",
 "identity_visibility": "face_obscured",
 "character_identifiability": "unidentifiable",
 "substitutability": 4,
 "overlays": [],
 "subject_salience": "guardian_hero",
 "action": [
  "ritual"
 ],
 "mood": [
  "lonely"
 ],
 "register": -1,
 "character": [],
 "caption": "A helmeted Guardian stands over a shrouded body laid out on pale cloth. Blue, still, funerary.",
 "faction": [],
 "clean": true,
 "footage_tier": "cinematic",
 "traversal_hero": false,
 "casting": {
  "role": "ensemble",
  "character": null,
  "person": null,
  "usable": true,
  "constraints_failed": [],
  "slots": 1
 },
 "provenance": {
  "era": {
   "source": "inherited",
   "label_source": "heuristic",
   "confidence": 0.9
  },
  "activity": {
   "source": "inherited",
   "label_source": "heuristic",
   "confidence": 0.8
  },
  "content_type": {
   "source": "observed",
   "label_source": "model",
   "confidence": 0.85
  },
  "destination": {
   "source": "inherited",
   "label_source": "model",
   "confidence": 0.5
  },
  "subclass_version": {
   "source": "inherited",
   "label_source": "model",
   "confidence": 0.5
  },
  "class": {
   "source": "observed",
   "label_source": "model",
   "confidence": 0.85
  },
  "element": {
   "source": "observed",
   "label_source": "model",
   "confidence": 0.85
  },
  "shot_scale": {
   "source": "observed",
   "label_source": "model",
   "confidence": 0.85
  },
  "composition": {
   "source": "observed",
   "label_source": "model",
   "confidence": 0.85
  },
  "camera_movement": {
   "source": "observed",
   "label_source": "model",
   "confidence": 0.85
  },
  "pacing": {
   "source": "observed",
   "label_source": "model",
   "confidence": 0.85
  },
  "lighting": {
   "source": "observed",
   "label_source": "model",
   "confidence": 0.85
  },
  "identity_visibility": {
   "source": "observed",
   "label_source": "model",
   "confidence": 0.85
  },
  "character_identifiability": {
   "source": "observed",
   "label_source": "model",
   "confidence": 0.85
  },
  "substitutability": {
   "source": "observed",
   "label_source": "model",
   "confidence": 0.85
  },
  "overlays": {
   "source": "observed",
   "label_source": "model",
   "confidence": 0.95
  },
  "subject_salience": {
   "source": "observed",
   "label_source": "model",
   "confidence": 0.85
  },
  "action": {
   "source": "observed",
   "label_source": "model",
   "confidence": 0.85
  },
  "mood": {
   "source": "observed",
   "label_source": "model",
   "confidence": 0.85
  },
  "register": {
   "source": "observed",
   "label_source": "model",
   "confidence": 0.85
  },
  "character": {
   "source": "observed",
   "label_source": "model",
   "confidence": 0.7
  },
  "caption": {
   "source": "observed",
   "label_source": "model",
   "confidence": 0.85
  },
  "faction": {
   "source": "observed",
   "label_source": "model",
   "confidence": 0.85
  },
  "clean": {
   "source": "observed",
   "label_source": "heuristic",
   "confidence": 1.0
  },
  "footage_tier": {
   "source": "observed",
   "label_source": "heuristic",
   "confidence": 1.0
  },
  "traversal_hero": {
   "source": "observed",
   "label_source": "heuristic",
   "confidence": 1.0
  },
  "casting": {
   "source": "observed",
   "label_source": "heuristic",
   "confidence": 1.0
  }
 }
}